{
  "useCaseName": "global-order-fulfillment",
  "queryLatencySlaMs": 75,
  "productionRowCounts": {
    "ORGANIZATION": 4200,
    "CUSTOMER": 2800000,
    "CUSTOMER_ADDRESS": 9100000,
    "PRODUCT": 18500000,
    "PRODUCT_VARIANT": 62000000,
    "PRODUCT_CATEGORY": 48000,
    "PRODUCT_CATEGORY_MAP": 74000000,
    "CUSTOMER_CONTRACT": 1200000,
    "CONTRACT_PRICE_LINE": 48000000,
    "ORDER_HEADER": 950000000,
    "ORDER_LINE": 4200000000,
    "ORDER_STATUS_HISTORY": 3800000000,
    "SHIPMENT": 780000000,
    "SHIPMENT_PACKAGE": 2100000000,
    "SHIPMENT_EVENT": 9600000000,
    "INVENTORY_POSITION": 140000000,
    "INVENTORY_RESERVATION": 520000000,
    "PAYMENT": 620000000,
    "INVOICE": 580000000,
    "PROMOTION": 180000,
    "PROMOTION_PRODUCT": 2400000,
    "ORDER_TAG": 12000,
    "ORDER_TAG_MAP": 1900000000,
    "RETURN_REQUEST": 42000000,
    "RETURN_LINE": 98000000
  },
  "dataModelingNotes": "Hot path #1: fetch single order by (org_id, order_number) with all lines, current status, and open shipments in one round-trip under 75ms. Hot path #2: warehouse picker scans inventory by (warehouse_id, sku) with quantity and reserved qty; must not load order aggregates. Hot path #3: customer portal lists orders by customer_id sorted by placed_at desc (paginated, 25/page). Contract pricing is resolved at order placement time and line unit_price is frozen on the order line. ORDER_STATUS_HISTORY and SHIPMENT_EVENT are append-only audit streams; UI usually shows last 5 events inline but compliance exports need full history by order. Promotions apply to a subset of SKUs; catalog browse filters by category tree. Returns reference original order lines but have their own workflow state.",
  "assumptions": [],
  "discountPercent": null,
  "supportUpliftPercent": null
}
